token,nombre,hex,rgb,cmyk,rol,uso_principal,texto_sugerido,ratio_texto
brand-black,Negro Base,#0B0F0E,"11,15,14","27,0,7,94",Base oscuro,"Texto principal, fondos oscuros","Sobre fondo claro","17.00 sobre #F5F0E8"
brand-green,Verde Tinta,#1E3A34,"30,58,52","48,0,10,77",Soporte premium,"Fondos institucionales, bloques destacados","Texto blanco","12.28 con #FFFFFF"
brand-lacre,Lacre Principal,#A64B34,"166,75,52","0,55,69,35",Acento principal,"CTA, botones, bullets, resaltes","Texto blanco","5.71 con #FFFFFF"
brand-lacre-dark,Lacre Oscuro,#8B3E2B,"139,62,43","0,55,69,45",Estado/hover,"Hover de boton y estados activos","Texto blanco","7.44 con #FFFFFF"
brand-salmon,Salmon Gradiente,#D4735E,"212,115,94","0,46,56,17",Acento secundario,"Gradientes de titulares","Texto oscuro","Usar en titulos, no en parrafo largo"
brand-bone,Hueso,#F5F0E8,"245,240,232","0,2,5,4",Base clara calida,"Fondos de seccion y docs","Texto oscuro o lacre","17.00 con #0B0F0E / 5.03 con #A64B34"
brand-offwhite,Off White,#FAFAF8,"250,250,248","0,0,1,2",Base clara neutra,"Fondos largos y slides","Texto oscuro o lacre","18.45 con #0B0F0E / 5.46 con #A64B34"
brand-white,Blanco,#FFFFFF,"255,255,255","0,0,0,0",Neutro absoluto,"Respiracion visual, cards","Texto oscuro o lacre oscuro","18.88 con #0B0F0E / 7.44 con #8B3E2B"
